{"schema_version":1,"batch_id":"fixture-batch-1","terms":[{"term":"example","identity_type":"search_term","provider":"fixture","provider_listing_id":"listing-1","position":0},{"term":"example two","identity_type":"search_term","provider":"fixture","provider_listing_id":"listing-2","position":1}],"geography":"US","timeframe":"2026-01-01 2026-02-28","timezone":"UTC","granularity":"month","search_property":"web","category":"0","language":"en","share_url":"https://trends.google.com/trends/explore","exported_at":"2026-08-21T00:00:00Z","expected_filename":"multiTimeline.csv"}
